{
  "id": "credential-ref:example",
  "recordType": "Trust.CredentialReference",
  "schemaVersion": 1,
  "createdAt": "2026-10-01T07:10:00.000Z",
  "updatedAt": "2026-10-01T07:10:00.000Z",
  "ownerId": "local:owner",
  "providerId": "connector.example",
  "opaqueRef": "session:example",
  "accountLabel": "Example account",
  "scopes": [
    "create"
  ],
  "mode": "browser-session"
}